id,de_cnae_principal
408,COMERCIO VAREJISTA DE MERCADORIAS EM GERAL COM PREDOMINANCIA DE PRODUTOS ALIMENTICIOS HIPERMERCADOS
409,COMERCIO VAREJISTA DE MERCADORIAS EM GERAL COM PREDOMINANCIA DE PRODUTOS ALIMENTICIOS SUPERMERCADOS
410,COMERCIO VAREJISTA DE MERCADORIAS EM GERAL COM PREDOMINANCIA DE PRODUTOS ALIMENTICIOS MINIMERCADOS MERCEARIAS E ARMAZENS
411,COMERCIO VAREJISTA DE MERCADORIAS EM GERAL COM PREDOMINANCIA DE PRODUTOS ALIMENTICIOS MINIMERCADOS MERCEARIAS E ARMAZENS DISPENSADA
412,LOJAS DE VARIEDADES EXCETO LOJAS DE DEPARTAMENTOS OU MAGAZINES
413,LOJAS DE DEPARTAMENTOS OU MAGAZINES EXCETO LOJAS FRANCAS DUTY FREE
414,PADARIA E CONFEITARIA COM PREDOMINANCIA DE REVENDA
415,PADARIA E CONFEITARIA COM PREDOMINANCIA DE REVENDA DISPENSADA
416,COMERCIO VAREJISTA DE LATICINIOS E FRIOS
417,COMERCIO VAREJISTA DE DOCES BALAS BOMBONS E SEMELHANTES
418,COMERCIO VAREJISTA DE CARNES ACOUGUES
419,COMERCIO VAREJISTA DE CARNES ACOUGUES DISPENSADA
420,PEIXARIA
421,COMERCIO VAREJISTA DE BEBIDAS
422,COMERCIO VAREJISTA DE BEBIDAS DISPENSADA
423,COMERCIO VAREJISTA DE HORTIFRUTIGRANJEIROS
424,TABACARIA
425,TABACARIA DISPENSADA
426,COMERCIO VAREJISTA DE MERCADORIAS EM LOJAS DE CONVENIENCIA
427,COMERCIO VAREJISTA DE PRODUTOS ALIMENTICIOS EM GERAL OU ESPECIALIZADO EM PRODUTOS ALIMENTICIOS NAO ESPECIFICADOS ANTERIORMENTE
428,COMERCIO VAREJISTA DE PRODUTOS ALIMENTICIOS EM GERAL OU ESPECIALIZADO EM PRODUTOS ALIMENTICIOS NAO ESPECIFICADOS ANTERIORMENTE DISPENSADA
429,COMERCIO VAREJISTA DE COMBUSTIVEIS PARA VEICULOS AUTOMOTORES
430,COMERCIO VAREJISTA DE LUBRIFICANTES
431,COMERCIO VAREJISTA DE TINTAS E MATERIAIS PARA PINTURA
432,COMERCIO VAREJISTA DE MATERIAL ELETRICO
433,COMERCIO VAREJISTA DE MATERIAL ELETRICO DISPENSADA
434,COMERCIO VAREJISTA DE VIDROS
435,COMERCIO VAREJISTA DE FERRAGENS E FERRAMENTAS
436,COMERCIO VAREJISTA DE FERRAGENS E FERRAMENTAS DISPENSADA
437,COMERCIO VAREJISTA DE MADEIRA E ARTEFATOS
438,COMERCIO VAREJISTA DE MATERIAIS HIDRAULICOS
439,COMERCIO VAREJISTA DE CAL AREIA PEDRA BRITADA TIJOLOS E TELHAS
440,COMERCIO VAREJISTA DE MATERIAIS DE CONSTRUCAO NAO ESPECIFICADOS ANTERIORMENTE
441,COMERCIO VAREJISTA DE PEDRAS PARA REVESTIMENTO DISPENSADA
442,COMERCIO VAREJISTA DE MATERIAIS DE CONSTRUCAO EM GERAL
443,COMERCIO VAREJISTA DE MATERIAIS DE CONSTRUCAO EM GERAL DISPENSADA
444,COMERCIO VAREJISTA ESPECIALIZADO DE EQUIPAMENTOS E SUPRIMENTOS DE INFORMATICA
445,RECARGA DE CARTUCHOS PARA EQUIPAMENTOS DE INFORMATICA
446,COMERCIO VAREJISTA ESPECIALIZADO DE EQUIPAMENTOS DE TELEFONIA E COMUNICACAO
447,COMERCIO VAREJISTA ESPECIALIZADO DE EQUIPAMENTOS DE TELEFONIA E COMUNICACAO DISPENSADA
448,COMERCIO VAREJISTA ESPECIALIZADO DE ELETRODOMESTICOS E EQUIPAMENTOS DE AUDIO E VIDEO
449,COMERCIO VAREJISTA ESPECIALIZADO DE ELETRODOMESTICOS E EQUIPAMENTOS DE AUDIO E VIDEO DISPENSADA
450,COMERCIO VAREJISTA DE MOVEIS
451,COMERCIO VAREJISTA DE MOVEIS DISPENSADA
452,COMERCIO VAREJISTA DE ARTIGOS DE COLCHOARIA
453,COMERCIO VAREJISTA DE ARTIGOS DE COLCHOARIA DISPENSADA
454,COMERCIO VAREJISTA DE ARTIGOS DE ILUMINACAO
455,COMERCIO VAREJISTA DE TECIDOS
456,COMERCIO VAREJISTA DE ARTIGOS DE ARMARINHO
457,COMERCIO VAREJISTA DE ARTIGOS DE ARMARINHO DISPENSADA
458,COMERCIO VAREJISTA DE ARTIGOS DE CAMA MESA E BANHO
459,COMERCIO VAREJISTA DE ARTIGOS DE CAMA MESA E BANHO DISPENSADA
460,COMERCIO VAREJISTA ESPECIALIZADO DE PECAS E ACESSORIOS PARA APARELHOS ELETROELETRONICOS PARA USO DOMESTICO EXCETO INFORMATICA E COMUNICACAO
461,COMERCIO VAREJISTA ESPECIALIZADO DE PECAS E ACESSORIOS PARA APARELHOS ELETROELETRONICOS PARA USO DOMESTICO EXCETO INFORMATICA E COMUNICACAO DISPENSADA
462,COMERCIO VAREJISTA DE ARTIGOS DE TAPECARIA CORTINAS E PERSIANAS
463,COMERCIO VAREJISTA DE OUTROS ARTIGOS DE USO PESSOAL E DOMESTICO NAO ESPECIFICADOS ANTERIORMENTE DISPENSADA
464,COMERCIO VAREJISTA DE OUTROS ARTIGOS DE USO PESSOAL E DOMESTICO NAO ESPECIFICADOS ANTERIORMENTE
465,COMERCIO VAREJISTA DE LIVROS
466,COMERCIO VAREJISTA DE JORNAIS E REVISTAS DISPENSADA
467,COMERCIO VAREJISTA DE JORNAIS E REVISTAS
468,COMERCIO VAREJISTA DE ARTIGOS DE PAPELARIA
469,COMERCIO VAREJISTA DE BRINQUEDOS E ARTIGOS RECREATIVOS
470,COMERCIO VAREJISTA DE ARTIGOS ESPORTIVOS
471,COMERCIO VAREJISTA DE ARTIGOS ESPORTIVOS DISPENSADA
472,COMERCIO VAREJISTA DE BICICLETAS E TRICICLOS PECAS E ACESSORIOS
473,COMERCIO VAREJISTA DE BICICLETAS E TRICICLOS PECAS E ACESSORIOS DISPENSADA
474,COMERCIO VAREJISTA DE ARTIGOS DE CACA PESCA E CAMPING
475,COMERCIO VAREJISTA DE EMBARCACOES E OUTROS VEICULOS RECREATIVOS PECAS E ACESSORIOS
476,COMERCIO VAREJISTA DE PRODUTOS FARMACEUTICOS SEM MANIPULACAO DE FORMULAS
477,COMERCIO VAREJISTA DE PRODUTOS FARMACEUTICOS COM MANIPULACAO DE FORMULAS
478,COMERCIO VAREJISTA DE MEDICAMENTOS VETERINARIOS DISPENSADA
479,COMERCIO VAREJISTA DE MEDICAMENTOS VETERINARIOS
480,COMERCIO VAREJISTA DE COSMETICOS PRODUTOS DE PERFUMARIA E DE HIGIENE PESSOAL
481,COMERCIO VAREJISTA DE COSMETICOS PRODUTOS DE PERFUMARIA E DE HIGIENE PESSOAL DISPENSADA
482,COMERCIO VAREJISTA DE ARTIGOS MEDICOS E ORTOPEDICOS
483,COMERCIO VAREJISTA DE ARTIGOS DE OPTICA
484,COMERCIO VAREJISTA DE ARTIGOS DO VESTUARIO E ACESSORIOS
485,COMERCIO VAREJISTA DE ARTIGOS DO VESTUARIO E ACESSORIOS DISPENSADA
486,COMERCIO VAREJISTA DE CALCADOS
487,COMERCIO VAREJISTA DE CALCADOS DISPENSADA
488,COMERCIO VAREJISTA DE ARTIGOS DE VIAGEM
489,COMERCIO VAREJISTA DE ARTIGOS DE JOALHERIA
490,COMERCIO VAREJISTA DE ARTIGOS DE RELOJOARIA
491,COMERCIO VAREJISTA DE GAS LIQUEFEITO DE PETROLEO GLP
492,COMERCIO VAREJISTA DE ANTIGUIDADES
493,COMERCIO VAREJISTA DE OUTROS ARTIGOS USADOS
494,COMERCIO VAREJISTA DE SUVENIRES BIJUTERIAS E ARTESANATOS
495,COMERCIO VAREJISTA DE SUVENIRES BIJUTERIAS E ARTESANATOS DISPENSADA
496,COMERCIO VAREJISTA DE PLANTAS E FLORES NATURAIS
497,COMERCIO VAREJISTA DE OBJETOS DE ARTE
498,COMERCIO VAREJISTA DE OBJETOS DE ARTE DISPENSADA
499,COMERCIO VAREJISTA DE ANIMAIS VIVOS E DE ARTIGOS E ALIMENTOS PARA ANIMAIS DE ESTIMACAO
500,COMERCIO VAREJISTA DE ANIMAIS VIVOS E DE ARTIGOS E ALIMENTOS PARA ANIMAIS DE ESTIMACAO DISPENSADA
501,COMERCIO VAREJISTA DE PRODUTOS SANEANTES DOMISSANITARIOS
502,COMERCIO VAREJISTA DE EQUIPAMENTOS PARA ESCRITORIO
503,COMERCIO VAREJISTA DE ARTIGOS FOTOGRAFICOS E PARA FILMAGEM
504,COMERCIO VAREJISTA DE OUTROS PRODUTOS NAO ESPECIFICADOS ANTERIORMENTE
505,TRANSPORTE FERROVIARIO DE CARGA
506,TRANSPORTE RODOVIARIO COLETIVO DE PASSAGEIROS COM ITINERARIO FIXO MUNICIPAL
507,TRANSPORTE RODOVIARIO COLETIVO DE PASSAGEIROS COM ITINERARIO FIXO INTERMUNICIPAL EM REGIAO METROPOLITANA
508,TRANSPORTE RODOVIARIO COLETIVO DE PASSAGEIROS COM ITINERARIO FIXO INTERMUNICIPAL EXCETO EM REGIAO METROPOLITANA
509,SERVICO DE TAXI
510,SERVICO DE TRANSPORTE DE PASSAGEIROS LOCACAO DE AUTOMOVEIS COM MOTORISTA
511,TRANSPORTE ESCOLAR
512,TRANSPORTE RODOVIARIO COLETIVO DE PASSAGEIROS SOB REGIME DE FRETAMENTO MUNICIPAL
513,TRANSPORTE RODOVIARIO COLETIVO DE PASSAGEIROS SOB REGIME DE FRETAMENTO INTERMUNICIPAL INTERESTADUAL E INTERNACIONAL
514,ORGANIZACAO DE EXCURSOES EM VEICULOS RODOVIARIOS PROPRIOS MUNICIPAL
515,TRANSPORTE RODOVIARIO DE CARGA EXCETO PRODUTOS PERIGOSOS E MUDANCAS MUNICIPAL
516,TRANSPORTE RODOVIARIO DE CARGA EXCETO PRODUTOS PERIGOSOS E MUDANCAS INTERMUNICIPAL INTERESTADUAL E INTERNACIONAL
517,TRANSPORTE RODOVIARIO DE CARGA EXCETO PRODUTOS PERIGOSOS E MUDANCAS INTERMUNICIPAL INTERESTADUAL E INTERNACIONAL DISPENSADA
518,TRANSPORTE RODOVIARIO DE PRODUTOS PERIGOSOS
519,TRANSPORTE RODOVIARIO DE MUDANCAS
520,TRANSPORTE POR NAVEGACAO INTERIOR DE CARGA INTERMUNICIPAL INTERESTADUAL E INTERNACIONAL EXCETO TRAVESSIA
521,TRANSPORTE POR NAVEGACAO DE TRAVESSIA MUNICIPAL
522,TRANSPORTE POR NAVEGACAO DE TRAVESSIA INTERMUNICIPAL INTERESTADUAL E INTERNACIONAL
523,TRANSPORTE AQUAVIARIO PARA PASSEIOS TURISTICOS
524,OUTROS TRANSPORTES AQUAVIARIOS NAO ESPECIFICADOS ANTERIORMENTE
525,ARMAZENS GERAIS EMISSAO DE WARRANT
526,DEPOSITOS DE MERCADORIAS PARA TERCEIROS EXCETO ARMAZENS GERAIS E GUARDA MOVEIS
527,CARGA E DESCARGA
528,ESTACIONAMENTO DE VEICULOS
529,SERVICOS DE REBOQUE DE VEICULOS
530,OUTRAS ATIVIDADES AUXILIARES DOS TRANSPORTES TERRESTRES NAO ESPECIFICADAS ANTERIORMENTE
531,ATIVIDADES DE AGENCIAMENTO MARITIMO
532,ATIVIDADES DE DESPACHANTES ADUANEIROS
533,AGENCIAMENTO DE CARGAS EXCETO PARA O TRANSPORTE MARITIMO
534,ORGANIZACAO LOGISTICA DO TRANSPORTE DE CARGA
535,OPERADOR DE TRANSPORTE MULTIMODAL OTM
536,ATIVIDADES DO CORREIO NACIONAL
537,SERVICOS DE MALOTE NAO REALIZADOS PELO CORREIO NACIONAL
538,SERVICOS DE ENTREGA RAPIDA
539,HOTEIS
540,CAMPINGS
541,PENSOES ALOJAMENTO
542,PENSOES ALOJAMENTO DISPENSADA
543,OUTROS ALOJAMENTOS NAO ESPECIFICADOS ANTERIORMENTE
544,RESTAURANTES E SIMILARES
545,RESTAURANTES E SIMILARES DISPENSADA
546,LANCHONETES CASAS DE CHA DE SUCOS E SIMILARES
547,LANCHONETES CASAS DE CHA DE SUCOS E SIMILARES DISPENSADA
548,BARES E OUTROS ESTABELECIMENTOS ESPECIALIZADOS EM SERVIR BEBIDAS SEM ENTRETENIMENTO
549,BARES E OUTROS ESTABELECIMENTOS ESPECIALIZADOS EM SERVIR BEBIDAS COM ENTRETENIMENTO
550,SERVICOS AMBULANTES DE ALIMENTACAO
551,FORNECIMENTO DE ALIMENTOS PREPARADOS PREPONDERANTEMENTE PARA EMPRESAS
552,SERVICOS DE ALIMENTACAO PARA EVENTOS E RECEPCOES BUFE
553,CANTINAS SERVICOS DE ALIMENTACAO PRIVATIVOS
554,FORNECIMENTO DE ALIMENTOS PREPARADOS PREPONDERANTEMENTE PARA CONSUMO DOMICILIAR
555,FORNECIMENTO DE ALIMENTOS PREPARADOS PREPONDERANTEMENTE PARA CONSUMO DOMICILIAR DISPENSADA
556,EDICAO DE LIVROS
557,EDICAO DE LIVROS DISPENSADA
558,EDICAO DE JORNAIS DIARIOS
559,EDICAO DE JORNAIS NAO DIARIOS
560,EDICAO DE REVISTAS
561,EDICAO DE CADASTROS LISTAS E DE OUTROS PRODUTOS GRAFICOS
562,EDICAO INTEGRADA A IMPRESSAO DE JORNAIS DIARIOS
563,ESTUDIOS CINEMATOGRAFICOS
564,PRODUCAO DE FILMES PARA PUBLICIDADE
565,ATIVIDADES DE PRODUCAO CINEMATOGRAFICA DE VIDEOS E DE PROGRAMAS DE TELEVISAO NAO ESPECIFICADAS ANTERIORMENTE
566,ATIVIDADES DE POS PRODUCAO CINEMATOGRAFICA DE VIDEOS E DE PROGRAMAS DE TELEVISAO NAO ESPECIFICADAS ANTERIORMENTE
567,ATIVIDADES DE GRAVACAO DE SOM E DE EDICAO DE MUSICA
568,ATIVIDADES DE RADIO
569,SERVICOS DE TELEFONIA FIXA COMUTADA STFC
570,SERVICOS DE COMUNICACAO MULTIMIDIA SCM
571,SERVICOS DE TELECOMUNICACOES SEM FIO NAO ESPECIFICADOS ANTERIORMENTE
572,PROVEDORES DE ACESSO AS REDES DE COMUNICACOES
573,OUTRAS ATIVIDADES DE TELECOMUNICACOES NAO ESPECIFICADAS ANTERIORMENTE
574,DESENVOLVIMENTO DE PROGRAMAS DE COMPUTADOR SOB ENCOMENDA
575,DESENVOLVIMENTO DE PROGRAMAS DE COMPUTADOR SOB ENCOMENDA DISPENSADA
576,DESENVOLVIMENTO E LICENCIAMENTO DE PROGRAMAS DE COMPUTADOR CUSTOMIZAVEIS DISPENSADA
577,DESENVOLVIMENTO E LICENCIAMENTO DE PROGRAMAS DE COMPUTADOR CUSTOMIZAVEIS
578,DESENVOLVIMENTO E LICENCIAMENTO DE PROGRAMAS DE COMPUTADOR NAO CUSTOMIZAVEIS
579,CONSULTORIA EM TECNOLOGIA DA INFORMACAO
580,CONSULTORIA EM TECNOLOGIA DA INFORMACAO DISPENSADA
581,SUPORTE TECNICO MANUTENCAO E OUTROS SERVICOS EM TECNOLOGIA DA INFORMACAO
582,SUPORTE TECNICO MANUTENCAO E OUTROS SERVICOS EM TECNOLOGIA DA INFORMACAO DISPENSADA
583,TRATAMENTO DE DADOS PROVEDORES DE SERVICOS DE APLICACAO E SERVICOS DE HOSPEDAGEM NA INTERNET
584,TRATAMENTO DE DADOS PROVEDORES DE SERVICOS DE APLICACAO E SERVICOS DE HOSPEDAGEM NA INTERNET DISPENSADA
585,PORTAIS PROVEDORES DE CONTEUDO E OUTROS SERVICOS DE INFORMACAO NA INTERNET
586,PORTAIS PROVEDORES DE CONTEUDO E OUTROS SERVICOS DE INFORMACAO NA INTERNET DISPENSADA
587,AGENCIAS DE NOTICIAS
588,OUTRAS ATIVIDADES DE PRESTACAO DE SERVICOS DE INFORMACAO NAO ESPECIFICADAS ANTERIORMENTE
589,BANCOS COMERCIAIS
590,BANCOS MULTIPLOS COM CARTEIRA COMERCIAL
591,BANCOS MULTIPLOS SEM CARTEIRA COMERCIAL
592,BANCOS DE INVESTIMENTO
593,SOCIEDADES DE CREDITO FINANCIAMENTO E INVESTIMENTO FINANCEIRAS
594,HOLDINGS DE INSTITUICOES FINANCEIRAS
595,HOLDINGS DE INSTITUICOES NAO FINANCEIRAS
596,HOLDINGS DE INSTITUICOES NAO FINANCEIRAS DISPENSADA
597,OUTRAS SOCIEDADES DE PARTICIPACAO EXCETO HOLDINGS
598,OUTRAS SOCIEDADES DE PARTICIPACAO EXCETO HOLDINGS DISPENSADA
599,FUNDOS DE INVESTIMENTO EXCETO PREVIDENCIARIOS E IMOBILIARIOS
600,FUNDOS DE INVESTIMENTO PREVIDENCIARIOS
601,FUNDOS DE INVESTIMENTO IMOBILIARIOS
602,SOCIEDADES DE FOMENTO MERCANTIL FACTORING
603,SECURITIZACAO DE CREDITOS
604,SECURITIZACAO DE CREDITOS DISPENSADA
605,CLUBES DE INVESTIMENTO
606,SOCIEDADES DE INVESTIMENTO
607,OUTRAS ATIVIDADES DE SERVICOS FINANCEIROS NAO ESPECIFICADAS ANTERIORMENTE
608,SOCIEDADE SEGURADORA DE SEGUROS NAO VIDA
609,RESSEGUROS
610,PLANOS DE SAUDE
611,CORRETORAS DE TITULOS E VALORES MOBILIARIOS
612,AGENTES DE INVESTIMENTOS EM APLICACOES FINANCEIRAS
613,ADMINISTRACAO DE CARTOES DE CREDITO
614,CORRESPONDENTES DE INSTITUICOES FINANCEIRAS
615,OUTRAS ATIVIDADES AUXILIARES DOS SERVICOS FINANCEIROS NAO ESPECIFICADAS ANTERIORMENTE
616,AUDITORIA E CONSULTORIA ATUARIAL
617,CORRETORES E AGENTES DE SEGUROS DE PLANOS DE PREVIDENCIA COMPLEMENTAR E DE SAUDE
618,CORRETORES E AGENTES DE SEGUROS DE PLANOS DE PREVIDENCIA COMPLEMENTAR E DE SAUDE DISPENSADA
619,ATIVIDADES AUXILIARES DOS SEGUROS DA PREVIDENCIA COMPLEMENTAR E DOS PLANOS DE SAUDE NAO ESPECIFICADAS ANTERIORMENTE
620,ATIVIDADES DE ADMINISTRACAO DE FUNDOS POR CONTRATO OU COMISSAO
621,COMPRA E VENDA DE IMOVEIS PROPRIOS
622,COMPRA E VENDA DE IMOVEIS PROPRIOS DISPENSADA
623,ALUGUEL DE IMOVEIS PROPRIOS
624,ALUGUEL DE IMOVEIS PROPRIOS DISPENSADA
625,LOTEAMENTO DE IMOVEIS PROPRIOS
626,LOTEAMENTO DE IMOVEIS PROPRIOS DISPENSADA
627,CORRETAGEM NA COMPRA E VENDA E AVALIACAO DE IMOVEIS DISPENSADA
628,CORRETAGEM NA COMPRA E VENDA E AVALIACAO DE IMOVEIS
629,CORRETAGEM NO ALUGUEL DE IMOVEIS
630,GESTAO E ADMINISTRACAO DA PROPRIEDADE IMOBILIARIA
631,GESTAO E ADMINISTRACAO DA PROPRIEDADE IMOBILIARIA DISPENSADA
632,SERVICOS ADVOCATICIOS
633,SERVICOS ADVOCATICIOS DISPENSADA
634,CARTORIOS
635,ATIVIDADES DE CONTABILIDADE
636,ATIVIDADES DE CONTABILIDADE DISPENSADA
637,ATIVIDADES DE CONSULTORIA E AUDITORIA CONTABIL E TRIBUTARIA DISPENSADA
638,ATIVIDADES DE CONSULTORIA E AUDITORIA CONTABIL E TRIBUTARIA
639,ATIVIDADES DE CONSULTORIA EM GESTAO EMPRESARIAL EXCETO CONSULTORIA TECNICA ESPECIFICA
640,ATIVIDADES DE CONSULTORIA EM GESTAO EMPRESARIAL EXCETO CONSULTORIA TECNICA ESPECIFICA DISPENSADA
641,SERVICOS DE ARQUITETURA
642,SERVICOS DE ARQUITETURA DISPENSADA
643,SERVICOS DE ENGENHARIA DISPENSADA
644,SERVICOS DE ENGENHARIA
645,ATIVIDADES DE ESTUDOS GEOLOGICOS
646,SERVICOS DE DESENHO TECNICO RELACIONADOS A ARQUITETURA E ENGENHARIA DISPENSADA
647,SERVICOS DE DESENHO TECNICO RELACIONADOS A ARQUITETURA E ENGENHARIA
648,SERVICOS DE PERICIA TECNICA RELACIONADOS A SEGURANCA DO TRABALHO
649,ATIVIDADES TECNICAS RELACIONADAS A ENGENHARIA E ARQUITETURA NAO ESPECIFICADAS ANTERIORMENTE
650,TESTES E ANALISES TECNICAS
651,PESQUISA E DESENVOLVIMENTO EXPERIMENTAL EM CIENCIAS FISICAS E NATURAIS
652,AGENCIAS DE PUBLICIDADE
653,AGENCIAS DE PUBLICIDADE DISPENSADA
654,AGENCIAMENTO DE ESPACOS PARA PUBLICIDADE EXCETO EM VEICULOS DE COMUNICACAO
655,PROMOCAO DE VENDAS
656,PROMOCAO DE VENDAS DISPENSADA
657,MARKETING DIRETO
658,MARKETING DIRETO DISPENSADA
659,CONSULTORIA EM PUBLICIDADE
660,OUTRAS ATIVIDADES DE PUBLICIDADE NAO ESPECIFICADAS ANTERIORMENTE
661,PESQUISAS DE MERCADO E DE OPINIAO PUBLICA
662,DESIGN DE INTERIORES
663,ATIVIDADES DE PRODUCAO DE FOTOGRAFIAS EXCETO AEREA E SUBMARINA
664,ATIVIDADES DE PRODUCAO DE FOTOGRAFIAS EXCETO AEREA E SUBMARINA DISPENSADA
665,ATIVIDADES DE PRODUCAO DE FOTOGRAFIAS AEREAS E SUBMARINAS
666,FILMAGEM DE FESTAS E EVENTOS
667,SERVICOS DE TRADUCAO INTERPRETACAO E SIMILARES
668,SERVICOS DE AGRONOMIA E DE CONSULTORIA AS ATIVIDADES AGRICOLAS E PECUARIAS DISPENSADA
669,SERVICOS DE AGRONOMIA E DE CONSULTORIA AS ATIVIDADES AGRICOLAS E PECUARIAS
670,ATIVIDADES DE INTERMEDIACAO E AGENCIAMENTO DE SERVICOS E NEGOCIOS EM GERAL EXCETO IMOBILIARIOS
671,ATIVIDADES DE INTERMEDIACAO E AGENCIAMENTO DE SERVICOS E NEGOCIOS EM GERAL EXCETO IMOBILIARIOS DISPENSADA
672,AGENCIAMENTO DE PROFISSIONAIS PARA ATIVIDADES ESPORTIVAS CULTURAIS E ARTISTICAS
673,OUTRAS ATIVIDADES PROFISSIONAIS CIENTIFICAS E TECNICAS NAO ESPECIFICADAS ANTERIORMENTE
674,OUTRAS ATIVIDADES PROFISSIONAIS CIENTIFICAS E TECNICAS NAO ESPECIFICADAS ANTERIORMENTE DISPENSADA
675,ATIVIDADES VETERINARIAS DISPENSADA
676,ATIVIDADES VETERINARIAS
677,LOCACAO DE AUTOMOVEIS SEM CONDUTOR
678,LOCACAO DE OUTROS MEIOS DE TRANSPORTE NAO ESPECIFICADOS ANTERIORMENTE SEM CONDUTOR
679,ALUGUEL DE EQUIPAMENTOS RECREATIVOS E ESPORTIVOS
680,ALUGUEL DE FITAS DE VIDEO DVDS E SIMILARES
681,ALUGUEL DE OBJETOS DO VESTUARIO JOIAS E ACESSORIOS DISPENSADA
682,ALUGUEL DE OBJETOS DO VESTUARIO JOIAS E ACESSORIOS
683,ALUGUEL DE APARELHOS DE JOGOS ELETRONICOS
684,ALUGUEL DE MOVEIS UTENSILIOS E APARELHOS DE USO DOMESTICO E PESSOAL INSTRUMENTOS MUSICAIS
685,ALUGUEL DE OUTROS OBJETOS PESSOAIS E DOMESTICOS NAO ESPECIFICADOS ANTERIORMENTE
686,ALUGUEL DE MAQUINAS E EQUIPAMENTOS AGRICOLAS SEM OPERADOR
687,ALUGUEL DE MAQUINAS E EQUIPAMENTOS PARA CONSTRUCAO SEM OPERADOR EXCETO ANDAIMES
688,ALUGUEL DE ANDAIMES
689,ALUGUEL DE MAQUINAS E EQUIPAMENTOS PARA ESCRITORIOS
690,ALUGUEL DE PALCOS COBERTURAS E OUTRAS ESTRUTURAS DE USO TEMPORARIO EXCETO ANDAIMES
691,ALUGUEL DE OUTRAS MAQUINAS E EQUIPAMENTOS COMERCIAIS E INDUSTRIAIS NAO ESPECIFICADOS ANTERIORMENTE SEM OPERADOR
692,GESTAO DE ATIVOS INTANGIVEIS NAO FINANCEIROS
693,SELECAO E AGENCIAMENTO DE MAO DE OBRA
694,LOCACAO DE MAO DE OBRA TEMPORARIA
695,AGENCIAS DE VIAGENS
696,AGENCIAS DE VIAGENS DISPENSADA
697,OPERADORES TURISTICOS
698,SERVICOS DE RESERVAS E OUTROS SERVICOS DE TURISMO NAO ESPECIFICADOS ANTERIORMENTE
699,ATIVIDADES DE VIGILANCIA E SEGURANCA PRIVADA
700,SERVICOS DE ADESTRAMENTO DE CAES DE GUARDA
701,ATIVIDADES DE MONITORAMENTO DE SISTEMAS DE SEGURANCA ELETRONICO DISPENSADA
702,ATIVIDADES DE MONITORAMENTO DE SISTEMAS DE SEGURANCA ELETRONICO
703,OUTRAS ATIVIDADES DE SERVICOS DE SEGURANCA
704,SERVICOS COMBINADOS PARA APOIO A EDIFICIOS EXCETO CONDOMINIOS PREDIAIS
705,CONDOMINIOS PREDIAIS
706,LIMPEZA EM PREDIOS E EM DOMICILIOS
707,IMUNIZACAO E CONTROLE DE PRAGAS URBANAS
708,ATIVIDADES DE LIMPEZA NAO ESPECIFICADAS ANTERIORMENTE
709,ATIVIDADES PAISAGISTICAS
710,SERVICOS COMBINADOS DE ESCRITORIO E APOIO ADMINISTRATIVO
711,SERVICOS COMBINADOS DE ESCRITORIO E APOIO ADMINISTRATIVO DISPENSADA
712,FOTOCOPIAS
713,PREPARACAO DE DOCUMENTOS E SERVICOS ESPECIALIZADOS DE APOIO ADMINISTRATIVO NAO ESPECIFICADOS ANTERIORMENTE
714,PREPARACAO DE DOCUMENTOS E SERVICOS ESPECIALIZADOS DE APOIO ADMINISTRATIVO NAO ESPECIFICADOS ANTERIORMENTE DISPENSADA
715,ATIVIDADES DE TELEATENDIMENTO
716,ATIVIDADES DE TELEATENDIMENTO DISPENSADA
717,SERVICOS DE ORGANIZACAO DE FEIRAS CONGRESSOS EXPOSICOES E FESTAS
718,SERVICOS DE ORGANIZACAO DE FEIRAS CONGRESSOS EXPOSICOES E FESTAS DISPENSADA
719,CASAS DE FESTAS E EVENTOS
720,ATIVIDADES DE COBRANCAS E INFORMACOES CADASTRAIS
721,ATIVIDADES DE COBRANCAS E INFORMACOES CADASTRAIS DISPENSADA
722,ENVASAMENTO E EMPACOTAMENTO SOB CONTRATO
723,SERVICOS DE GRAVACAO DE CARIMBOS EXCETO CONFECCAO
724,CASAS LOTERICAS
725,SALAS DE ACESSO A INTERNET
726,OUTRAS ATIVIDADES DE SERVICOS PRESTADOS PRINCIPALMENTE AS EMPRESAS NAO ESPECIFICADAS ANTERIORMENTE
727,ADMINISTRACAO PUBLICA EM GERAL
728,REGULACAO DAS ATIVIDADES DE SAUDE EDUCACAO SERVICOS CULTURAIS E OUTROS SERVICOS SOCIAIS
729,REGULACAO DAS ATIVIDADES ECONOMICAS
730,DEFESA
731,JUSTICA
732,EDUCACAO INFANTIL CRECHE
733,EDUCACAO INFANTIL PRE ESCOLA
734,ENSINO FUNDAMENTAL
735,ENSINO MEDIO
736,EDUCACAO SUPERIOR GRADUACAO
737,EDUCACAO SUPERIOR GRADUACAO E POS GRADUACAO
738,EDUCACAO SUPERIOR POS GRADUACAO E EXTENSAO
739,EDUCACAO PROFISSIONAL DE NIVEL TECNICO
740,ADMINISTRACAO DE CAIXAS ESCOLARES
741,ATIVIDADES DE APOIO A EDUCACAO EXCETO CAIXAS ESCOLARES
742,ENSINO DE ESPORTES
743,ENSINO DE ARTES CENICAS EXCETO DANCA
744,ENSINO DE MUSICA
745,ENSINO DE ARTE E CULTURA NAO ESPECIFICADO ANTERIORMENTE
746,ENSINO DE IDIOMAS
747,ENSINO DE IDIOMAS DISPENSADA
748,FORMACAO DE CONDUTORES
749,TREINAMENTO EM INFORMATICA
750,TREINAMENTO EM INFORMATICA DISPENSADA
751,TREINAMENTO EM DESENVOLVIMENTO PROFISSIONAL E GERENCIAL
752,TREINAMENTO EM DESENVOLVIMENTO PROFISSIONAL E GERENCIAL DISPENSADA
753,CURSOS PREPARATORIOS PARA CONCURSOS
754,OUTRAS ATIVIDADES DE ENSINO NAO ESPECIFICADAS ANTERIORMENTE
755,ATIVIDADES DE ATENDIMENTO HOSPITALAR EXCETO PRONTO SOCORRO E UNIDADES PARA ATENDIMENTO A URGENCIAS
756,ATIVIDADES DE ATENDIMENTO EM PRONTO SOCORRO E UNIDADES HOSPITALARES PARA ATENDIMENTO A URGENCIAS
757,SERVICOS MOVEIS DE ATENDIMENTO A URGENCIAS EXCETO POR UTI MOVEL
758,ATIVIDADE MEDICA AMBULATORIAL COM RECURSOS PARA REALIZACAO DE PROCEDIMENTOS CIRURGICOS
759,ATIVIDADE MEDICA AMBULATORIAL COM RECURSOS PARA REALIZACAO DE EXAMES COMPLEMENTARES
760,ATIVIDADE MEDICA AMBULATORIAL RESTRITA A CONSULTAS
761,ATIVIDADE ODONTOLOGICA
762,SERVICOS DE VACINACAO E IMUNIZACAO HUMANA
763,ATIVIDADES DE ATENCAO AMBULATORIAL NAO ESPECIFICADAS ANTERIORMENTE
764,LABORATORIOS CLINICOS
765,SERVICOS DE DIALISE E NEFROLOGIA
766,SERVICOS DE TOMOGRAFIA
767,SERVICOS DE DIAGNOSTICO POR IMAGEM COM USO DE RADIACAO IONIZANTE EXCETO TOMOGRAFIA
768,SERVICOS DE RESSONANCIA MAGNETICA
769,SERVICOS DE DIAGNOSTICO POR IMAGEM SEM USO DE RADIACAO IONIZANTE EXCETO RESSONANCIA MAGNETICA
770,SERVICOS DE DIAGNOSTICO POR REGISTRO GRAFICO ECG EEG E OUTROS EXAMES ANALOGOS
771,SERVICOS DE DIAGNOSTICO POR METODOS OPTICOS ENDOSCOPIA E OUTROS EXAMES ANALOGOS
772,ATIVIDADES DE SERVICOS DE COMPLEMENTACAO DIAGNOSTICA E TERAPEUTICA NAO ESPECIFICADAS ANTERIORMENTE
773,ATIVIDADES DE ENFERMAGEM
774,ATIVIDADES DE PROFISSIONAIS DA NUTRICAO
775,ATIVIDADES DE PROFISSIONAIS DA NUTRICAO DISPENSADA
776,ATIVIDADES DE PSICOLOGIA E PSICANALISE
777,ATIVIDADES DE PSICOLOGIA E PSICANALISE DISPENSADA
778,ATIVIDADES DE FISIOTERAPIA
779,ATIVIDADES DE PROFISSIONAIS DA AREA DE SAUDE NAO ESPECIFICADAS ANTERIORMENTE
780,ATIVIDADES DE APOIO A GESTAO DE SAUDE
781,ATIVIDADES DE APOIO A GESTAO DE SAUDE DISPENSADA
782,ATIVIDADES DE PRATICAS INTEGRATIVAS E COMPLEMENTARES EM SAUDE HUMANA
783,CLINICAS E RESIDENCIAS GERIATRICAS
784,INSTITUICOES DE LONGA PERMANENCIA PARA IDOSOS
785,ATIVIDADES DE FORNECIMENTO DE INFRA ESTRUTURA DE APOIO E ASSISTENCIA A PACIENTE NO DOMICILIO
786,ATIVIDADES DE ASSISTENCIA PSICOSSOCIAL E A SAUDE A PORTADORES DE DISTURBIOS PSIQUICOS DEFICIENCIA MENTAL E DEPENDENCIA QUIMICA E GRUPOS SIMILARES NAO ESPECIFICADAS ANTERIORMENTE
787,ATIVIDADES DE ASSISTENCIA SOCIAL PRESTADAS EM RESIDENCIAS COLETIVAS E PARTICULARES NAO ESPECIFICADAS ANTERIORMENTE
788,SERVICOS DE ASSISTENCIA SOCIAL SEM ALOJAMENTO
789,PRODUCAO TEATRAL
790,PRODUCAO MUSICAL
791,PRODUCAO DE ESPETACULOS DE RODEIOS VAQUEJADAS E SIMILARES
792,ATIVIDADES DE SONORIZACAO E DE ILUMINACAO
793,ARTES CENICAS ESPETACULOS E ATIVIDADES COMPLEMENTARES NAO ESPECIFICADAS ANTERIORMENTE
794,ATIVIDADES DE ARTISTAS PLASTICOS JORNALISTAS INDEPENDENTES E ESCRITORES
795,RESTAURACAO DE OBRAS DE ARTE
796,EXPLORACAO DE JOGOS DE AZAR E APOSTAS NAO ESPECIFICADOS ANTERIORMENTE
797,GESTAO DE INSTALACOES DE ESPORTES
798,CLUBES SOCIAIS ESPORTIVOS E SIMILARES
799,ATIVIDADES DE CONDICIONAMENTO FISICO
800,PRODUCAO E PROMOCAO DE EVENTOS ESPORTIVOS
801,OUTRAS ATIVIDADES ESPORTIVAS NAO ESPECIFICADAS ANTERIORMENTE
802,DISCOTECAS DANCETERIAS SALOES DE DANCA E SIMILARES
803,EXPLORACAO DE JOGOS ELETRONICOS RECREATIVOS
804,OUTRAS ATIVIDADES DE RECREACAO E LAZER NAO ESPECIFICADAS ANTERIORMENTE
805,ATIVIDADES DE ORGANIZACOES ASSOCIATIVAS PATRONAIS E EMPRESARIAIS
806,OUTRAS ATIVIDADES ASSOCIATIVAS PROFISSIONAIS
807,ATIVIDADES DE ORGANIZACOES SINDICAIS
808,ATIVIDADES DE ASSOCIACOES DE DEFESA DE DIREITOS SOCIAIS
809,ATIVIDADES DE ASSOCIACOES DE DEFESA DE DIREITOS SOCIAIS DISPENSADA
810,ATIVIDADES DE ORGANIZACOES RELIGIOSAS OU FILOSOFICAS
811,ATIVIDADES DE ORGANIZACOES POLITICAS
812,ATIVIDADES DE ORGANIZACOES ASSOCIATIVAS LIGADAS A CULTURA E A ARTE
813,ATIVIDADES ASSOCIATIVAS NAO ESPECIFICADAS ANTERIORMENTE
814,ATIVIDADES ASSOCIATIVAS NAO ESPECIFICADAS ANTERIORMENTE DISPENSADA
815,REPARACAO E MANUTENCAO DE COMPUTADORES E DE EQUIPAMENTOS PERIFERICOS
816,REPARACAO E MANUTENCAO DE COMPUTADORES E DE EQUIPAMENTOS PERIFERICOS DISPENSADA
817,REPARACAO E MANUTENCAO DE EQUIPAMENTOS DE COMUNICACAO
818,REPARACAO E MANUTENCAO DE EQUIPAMENTOS ELETROELETRONICOS DE USO PESSOAL E DOMESTICO
819,REPARACAO DE CALCADOS BOLSAS E ARTIGOS DE VIAGEM
820,CHAVEIROS
821,REPARACAO DE BICICLETAS TRICICLOS E OUTROS VEICULOS NAO MOTORIZADOS
822,REPARACAO DE ARTIGOS DO MOBILIARIO
823,REPARACAO DE JOIAS
824,REPARACAO E MANUTENCAO DE OUTROS OBJETOS E EQUIPAMENTOS PESSOAIS E DOMESTICOS NAO ESPECIFICADOS ANTERIORMENTE
825,LAVANDERIAS
826,TINTURARIAS
827,TOALHEIROS
828,CABELEIREIROS MANICURE E PEDICURE
829,ATIVIDADES DE ESTETICA E OUTROS SERVICOS DE CUIDADOS COM A BELEZA
830,GESTAO E MANUTENCAO DE CEMITERIOS
831,SERVICOS DE FUNERARIAS
832,ATIVIDADES FUNERARIAS E SERVICOS RELACIONADOS NAO ESPECIFICADOS ANTERIORMENTE
833,SERVICOS DE TATUAGEM E COLOCACAO DE PIERCING
834,ALOJAMENTO DE ANIMAIS DOMESTICOS
835,HIGIENE E EMBELEZAMENTO DE ANIMAIS DOMESTICOS
836,OUTRAS ATIVIDADES DE SERVICOS PESSOAIS NAO ESPECIFICADAS ANTERIORMENTE
837,SERVICOS DOMESTICOS